{"$schema":"https://json-schema.org/draft/2020-12/schema","$id":"physics-run.schema.json","title":"Physics Run","type":"object","required":["schema_version","run_id","engine","units","timing","authority","network","platform","budget","seed"],"properties":{"schema_version":{"type":"string","minLength":1,"pattern":"\\S"},"run_id":{"type":"string","minLength":1,"pattern":"\\S"},"engine":{"type":"string","minLength":1,"pattern":"\\S"},"units":{"type":"string","minLength":1,"pattern":"\\S"},"authority":{"type":"string","minLength":1,"pattern":"\\S"},"network":{"type":"string","minLength":1,"pattern":"\\S"},"platform":{"type":"string","minLength":1,"pattern":"\\S"},"seed":{"type":"integer"},"timing":{"type":"object","required":["render_fps_target","physics_hz","fixed_dt_seconds","max_substeps"],"properties":{"render_fps_target":{"type":"number","exclusiveMinimum":0},"physics_hz":{"type":"number","exclusiveMinimum":0},"fixed_dt_seconds":{"type":"number","exclusiveMinimum":0},"max_substeps":{"type":"integer","minimum":1}},"additionalProperties":false},"budget":{"type":"object","required":["cpu_ms","gpu_ms","memory_mb"],"properties":{"cpu_ms":{"type":"number","minimum":0},"gpu_ms":{"type":"number","minimum":0},"memory_mb":{"type":"number","minimum":0}},"additionalProperties":false}},"additionalProperties":false}
